{"$id":"https://reasoning-distiller.invalid/schemas/canonical-recovery-damage-analysis.schema.json","$schema":"https://json-schema.org/draft/2020-12/schema","additionalProperties":false,"properties":{"blocked_checks":{"items":{"minLength":1,"type":"string"},"type":"array","uniqueItems":true},"candidate_count":{"const":0},"contract":{"const":"reasoning-distiller-canonical-recovery-damage-analysis/1"},"damage_set":{"additionalProperties":false,"properties":{"additional_damage":{"type":"boolean"},"defects":{"items":{"additionalProperties":false,"properties":{"instance_path":{"type":"string"},"keyword":{"minLength":1,"type":"string"},"message":{"minLength":1,"type":"string"}},"required":["instance_path","keyword","message"],"type":"object"},"type":"array"},"ordered_relation_set_sha256":{"$ref":"canonical-recovery-mode-b-common.schema.json#/$defs/sha256"},"profile_id":{"const":"reasoning-distiller-project-a0-missing-relation-fields/1"},"relation_count":{"minimum":0,"type":"integer"}},"required":["profile_id","relation_count","ordered_relation_set_sha256","defects","additional_damage"],"type":"object"},"evidence_inventory":{"$ref":"canonical-recovery-mode-b-common.schema.json#/$defs/artifact_ref"},"integrity":{"additionalProperties":false,"properties":{"duplicate_relation_ids":{"type":"boolean"},"endpoints_valid":{"type":"boolean"},"pems_cove_decode_equal":{"type":"boolean"}},"required":["pems_cove_decode_equal","duplicate_relation_ids","endpoints_valid"],"type":"object"},"prestate":{"$ref":"canonical-recovery-mode-b-common.schema.json#/$defs/pair"},"project":{"$ref":"canonical-recovery-mode-b-common.schema.json#/$defs/project"},"semantic":{"const":"pems/2"},"toolchain":{"additionalProperties":false,"properties":{"cove_codec_sha256":{"$ref":"canonical-recovery-mode-b-common.schema.json#/$defs/sha256"},"normalizer_sha256":{"$ref":"canonical-recovery-mode-b-common.schema.json#/$defs/sha256"},"pems_schema_sha256":{"$ref":"canonical-recovery-mode-b-common.schema.json#/$defs/sha256"},"semantic_validator_sha256":{"$ref":"canonical-recovery-mode-b-common.schema.json#/$defs/sha256"}},"required":["pems_schema_sha256","semantic_validator_sha256","normalizer_sha256","cove_codec_sha256"],"type":"object"}},"required":["contract","project","prestate","semantic","toolchain","damage_set","integrity","blocked_checks","evidence_inventory","candidate_count"],"type":"object"}
