{"blocked_checks":["relation lifecycle vocabulary and lifecycle-dependent semantics","relation data schema and kind-specific semantic values","depends_on dependency_kind semantic validity"],"candidate_count":0,"contract":"reasoning-distiller-canonical-recovery-damage-analysis/1","damage_set":{"additional_damage":false,"defects":[{"instance_path":"/relations/0/data","keyword":"required","message":"required property absent"},{"instance_path":"/relations/0/lifecycle","keyword":"required","message":"required property absent"},{"instance_path":"/relations/1/data","keyword":"required","message":"required property absent"},{"instance_path":"/relations/1/lifecycle","keyword":"required","message":"required property absent"},{"instance_path":"/relations/10/data","keyword":"required","message":"required property absent"},{"instance_path":"/relations/10/lifecycle","keyword":"required","message":"required property absent"},{"instance_path":"/relations/100/data","keyword":"required","message":"required property absent"},{"instance_path":"/relations/100/lifecycle","keyword":"required","message":"required property absent"},{"instance_path":"/relations/101/data","keyword":"required","message":"required property absent"},{"instance_path":"/relations/101/lifecycle","keyword":"required","message":"required property absent"},{"instance_path":"/relations/102/data","keyword":"required","message":"required property absent"},{"instance_path":"/relations/102/lifecycle","keyword":"required","message":"required property absent"},{"instance_path":"/relations/103/data","keyword":"required","message":"required property absent"},{"instance_path":"/relations/103/lifecycle","keyword":"required","message":"required property absent"},{"instance_path":"/relations/104/data","keyword":"required","message":"required property absent"},{"instance_path":"/relations/104/lifecycle","keyword":"required","message":"required property absent"},{"instance_path":"/relations/105/data","keyword":"required","message":"required property absent"},{"instance_path":"/relations/105/lifecycle","keyword":"required","message":"required property absent"},{"instance_path":"/relations/106/data","keyword":"required","message":"required property absent"},{"instance_path":"/relations/106/lifecycle","keyword":"required","message":"required property absent"},{"instance_path":"/relations/107/data","keyword":"required","message":"required property absent"},{"instance_path":"/relations/107/lifecycle","keyword":"required","message":"required property absent"},{"instance_path":"/relations/108/data","keyword":"required","message":"required property absent"},{"instance_path":"/relations/108/lifecycle","keyword":"required","message":"required property absent"},{"instance_path":"/relations/109/data","keyword":"required","message":"required property absent"},{"instance_path":"/relations/109/lifecycle","keyword":"required","message":"required property absent"},{"instance_path":"/relations/11/data","keyword":"required","message":"required property absent"},{"instance_path":"/relations/11/lifecycle","keyword":"required","message":"required property absent"},{"instance_path":"/relations/110/data","keyword":"required","message":"required property absent"},{"instance_path":"/relations/110/lifecycle","keyword":"required","message":"required property absent"},{"instance_path":"/relations/111/data","keyword":"required","message":"required property absent"},{"instance_path":"/relations/111/lifecycle","keyword":"required","message":"required property absent"},{"instance_path":"/relations/112/data","keyword":"required","message":"required property absent"},{"instance_path":"/relations/112/lifecycle","keyword":"required","message":"required property absent"},{"instance_path":"/relations/113/data","keyword":"required","message":"required property absent"},{"instance_path":"/relations/113/lifecycle","keyword":"required","message":"required property absent"},{"instance_path":"/relations/114/data","keyword":"required","message":"required property absent"},{"instance_path":"/relations/114/lifecycle","keyword":"required","message":"required property absent"},{"instance_path":"/relations/115/data","keyword":"required","message":"required property absent"},{"instance_path":"/relations/115/lifecycle","keyword":"required","message":"required property absent"},{"instance_path":"/relations/116/data","keyword":"required","message":"required property absent"},{"instance_path":"/relations/116/lifecycle","keyword":"required","message":"required property absent"},{"instance_path":"/relations/117/data","keyword":"required","message":"required property absent"},{"instance_path":"/relations/117/lifecycle","keyword":"required","message":"required property absent"},{"instance_path":"/relations/118/data","keyword":"required","message":"required property absent"},{"instance_path":"/relations/118/lifecycle","keyword":"required","message":"required property absent"},{"instance_path":"/relations/119/data","keyword":"required","message":"required property absent"},{"instance_path":"/relations/119/lifecycle","keyword":"required","message":"required property absent"},{"instance_path":"/relations/12/data","keyword":"required","message":"required property absent"},{"instance_path":"/relations/12/lifecycle","keyword":"required","message":"required property absent"},{"instance_path":"/relations/120/data","keyword":"required","message":"required property absent"},{"instance_path":"/relations/120/lifecycle","keyword":"required","message":"required property absent"},{"instance_path":"/relations/121/data","keyword":"required","message":"required property absent"},{"instance_path":"/relations/121/lifecycle","keyword":"required","message":"required property absent"},{"instance_path":"/relations/122/data","keyword":"required","message":"required property absent"},{"instance_path":"/relations/122/lifecycle","keyword":"required","message":"required property absent"},{"instance_path":"/relations/123/data","keyword":"required","message":"required property absent"},{"instance_path":"/relations/123/lifecycle","keyword":"required","message":"required property absent"},{"instance_path":"/relations/124/data","keyword":"required","message":"required property absent"},{"instance_path":"/relations/124/lifecycle","keyword":"required","message":"required property absent"},{"instance_path":"/relations/125/data","keyword":"required","message":"required property absent"},{"instance_path":"/relations/125/lifecycle","keyword":"required","message":"required property absent"},{"instance_path":"/relations/126/data","keyword":"required","message":"required property absent"},{"instance_path":"/relations/126/lifecycle","keyword":"required","message":"required property absent"},{"instance_path":"/relations/127/data","keyword":"required","message":"required property absent"},{"instance_path":"/relations/127/lifecycle","keyword":"required","message":"required property absent"},{"instance_path":"/relations/128/data","keyword":"required","message":"required property absent"},{"instance_path":"/relations/128/lifecycle","keyword":"required","message":"required property absent"},{"instance_path":"/relations/129/data","keyword":"required","message":"required property absent"},{"instance_path":"/relations/129/lifecycle","keyword":"required","message":"required property absent"},{"instance_path":"/relations/13/data","keyword":"required","message":"required property absent"},{"instance_path":"/relations/13/lifecycle","keyword":"required","message":"required property absent"},{"instance_path":"/relations/130/data","keyword":"required","message":"required property absent"},{"instance_path":"/relations/130/lifecycle","keyword":"required","message":"required property absent"},{"instance_path":"/relations/131/data","keyword":"required","message":"required property absent"},{"instance_path":"/relations/131/lifecycle","keyword":"required","message":"required property absent"},{"instance_path":"/relations/132/data","keyword":"required","message":"required property absent"},{"instance_path":"/relations/132/lifecycle","keyword":"required","message":"required property absent"},{"instance_path":"/relations/133/data","keyword":"required","message":"required property absent"},{"instance_path":"/relations/133/lifecycle","keyword":"required","message":"required property absent"},{"instance_path":"/relations/134/data","keyword":"required","message":"required property absent"},{"instance_path":"/relations/134/lifecycle","keyword":"required","message":"required property absent"},{"instance_path":"/relations/135/data","keyword":"required","message":"required property absent"},{"instance_path":"/relations/135/lifecycle","keyword":"required","message":"required property absent"},{"instance_path":"/relations/136/data","keyword":"required","message":"required property absent"},{"instance_path":"/relations/136/lifecycle","keyword":"required","message":"required property absent"},{"instance_path":"/relations/137/data","keyword":"required","message":"required property absent"},{"instance_path":"/relations/137/lifecycle","keyword":"required","message":"required property absent"},{"instance_path":"/relations/138/data","keyword":"required","message":"required property absent"},{"instance_path":"/relations/138/lifecycle","keyword":"required","message":"required property absent"},{"instance_path":"/relations/139/data","keyword":"required","message":"required property absent"},{"instance_path":"/relations/139/lifecycle","keyword":"required","message":"required property absent"},{"instance_path":"/relations/14/data","keyword":"required","message":"required property absent"},{"instance_path":"/relations/14/lifecycle","keyword":"required","message":"required property absent"},{"instance_path":"/relations/140/data","keyword":"required","message":"required property absent"},{"instance_path":"/relations/140/lifecycle","keyword":"required","message":"required property absent"},{"instance_path":"/relations/141/data",